"Graphical Models : Representations for Learning, Reasoning and Data Mining","Christian Borgelt, Matthias Steinbrecher, Rudolf R Kruse",2307.0,https://d1w7fb2mkkr3kw.cloudfront.net/assets/images/book/mid/9780/4707/9780470722107.jpg,,404.0,Hardback,2009-10-05,Wiley,English,047072210X,9780470722107,New York,United States,160.0,240.0,27.0,718.0,2009,10
Data Analysis : What Can Be Learned From the Past 50 Years,Peter J. Huber,3757.0,https://d1w7fb2mkkr3kw.cloudfront.net/assets/images/book/mid/9781/1180/9781118010648.jpg,4.0,234.0,Hardback,2011-04-19,Wiley,English,1118010647,9781118010648,New York,United States,158.0,244.0,19.0,504.0,2011,4
The Alignment Problem : How Can Machines Learn Human Values?,Brian Christian,687.0,https://d1w7fb2mkkr3kw.cloudfront.net/assets/images/book/lrg/9781/7864/9781786494306.jpg,,496.0,Hardback,2021-01-21,ATLANTIC BOOKS,English,1786494302,9781786494306,London,United Kingdom,165.0,242.0,47.0,915.0,2021,1
Turn Your Computer Into a Money Machine : Learn the Fastest and Easiest Way to Make Money From Home and Grow Your Income as a Beginner Complete Volume,Phil Wall,452.0,https://d1w7fb2mkkr3kw.cloudfront.net/assets/images/book/lrg/9781/6477/9781647773113.jpg,,142.0,Hardback,2020-01-26,Kazravan Enterprises LLC,English,1647773113,9781647773113,,,,,,,2020,1
Turn Your Computer Into a Money Machine : Learn the Fastest and Easiest Way to Make Money From Home and Grow Your Income as a Beginner Volume 1,Phil Wall,494.0,https://d1w7fb2mkkr3kw.cloudfront.net/assets/images/book/lrg/9781/6477/9781647772390.jpg,,56.0,Hardback,2020-01-10,Kazravan Enterprises LLC,English,1647772397,9781647772390,,,127.0,203.0,6.0,172.0,2020,1
"Java Programming : Learn How to Code with an Object-Oriented Program to Improve Your Software Engineering Skills. Get Familiar with Virtual Machine, Javascript, and Machine Code",Alan Grid,881.0,https://d1w7fb2mkkr3kw.cloudfront.net/assets/images/book/lrg/9781/9140/9781914045103.jpg,,160.0,Hardback,2020-11-14,Via Etenea Ltd,English,1914045106,9781914045103,,,152.0,229.0,11.0,386.0,2020,11
"Cricut for Beginners : The Ultimate Guide To Start, Learn and Create Your Perfect Projects, Tip And Tricks To Cricut Machine",Maggie Craft,942.0,https://d1w7fb2mkkr3kw.cloudfront.net/assets/images/book/lrg/9781/8011/9781801159500.jpg,,162.0,Hardback,2020-11-01,ABCD Ltd,English,1801159505,9781801159500,,,152.0,229.0,11.0,386.0,2020,11
cricut for beginners : An Updated Beginner's Guide to Learn How to Use and Install Every Functions of the Top Cricut Machines with Detailed Illustrations + Tips and Tricks to Make,Craft Whit Lisa Design,824.0,https://d1w7fb2mkkr3kw.cloudfront.net/assets/images/book/lrg/9781/8011/9781801117333.jpg,,108.0,Hardback,2020-11-01,Diomede Ienna,English,1801117330,9781801117333,,,152.0,229.0,8.0,318.0,2020,11
Cricut Design Space for Beginners : A Step by Step Guide to Learn How to Use your First Cricut Machine. Includes Original Project Ideas with Advanced Tips and Tricks,Carol White,831.0,https://d1w7fb2mkkr3kw.cloudfront.net/assets/images/book/lrg/9781/8011/9781801157933.jpg,,146.0,Hardback,2020-12-05,Flower Books Ltd,English,1801157936,9781801157933,,,152.0,229.0,10.0,367.0,2020,12
"Excel for beginners : Learn Excel 2016, Including an Introduction to Formulas, Functions, Graphs, Charts, Macros, Modelling, Pivot Tables, Dashboards, Reports, Statistics, Excel Power Query, and More",Greg Shields,813.0,https://d1w7fb2mkkr3kw.cloudfront.net/assets/images/book/mid/9781/6474/9781647483463.jpg,,82.0,Hardback,2020-01-10,Bravex Publications,English,1647483468,9781647483463,,,152.0,229.0,6.0,281.0,2020,1
"Engineering General Intelligence, Part 1 : A Path to Advanced AGI via Embodied Learning and Cognitive Synergy","Ben Goertzel, Cassio Pennachin, Nil Geisweiller",3449.0,https://d1w7fb2mkkr3kw.cloudfront.net/assets/images/book/lrg/9789/4623/9789462390263.jpg,4.33,409.0,Hardback,2014-03-12,Atlantis Press (Zeger Karssen),English,9462390266,9789462390263,Paris,Netherlands,155.0,235.0,30.48,7686.0,2014,3
Cricut Explore Air 2 : A very simple guide to learn how to set up your cricut machine and start creating from today amazing projects. Master all the tips and tricks to become a cricut expert!,Lara Craft,900.0,https://d1w7fb2mkkr3kw.cloudfront.net/assets/images/book/lrg/9781/8012/9781801251976.jpg,,160.0,Hardback,2020-11-14,Charlie Creative Lab,English,1801251975,9781801251976,,,152.0,229.0,11.0,386.0,2020,11
"Cricut : Three books in one: Cricut For Beginners, Design Space; 100 Project Ideas. A Pratical And Complete Step By Step Guide With Illustrated Projects, How To Learn Tools And Function Of Your Cutting Machine.",Maggie Craft,1303.0,https://d1w7fb2mkkr3kw.cloudfront.net/assets/images/book/lrg/9781/8011/9781801159487.jpg,,748.0,Hardback,2020-11-07,ABCD Ltd,English,1801159483,9781801159487,,,152.0,229.0,40.0,1161.0,2020,11
"Hands-on Machine Learning with Scikit-Learn, Keras, and TensorFlow : Concepts, Tools, and Techniques to Build Intelligent Systems",Aurelien Geron,1460.0,https://d1w7fb2mkkr3kw.cloudfront.net/assets/images/book/lrg/9781/4920/9781492032649.jpg,4.67,600.0,Paperback,2019-10-15,"O'Reilly Media, Inc, USA",English,1492032646,9781492032649,Sebastopol,United States,178.0,233.0,30.48,1270.06,2019,10
Introduction to Machine Learning with Python : A Guide for Data Scientists,"Sarah Guido, Andreas C. Mueller",1257.0,https://d1w7fb2mkkr3kw.cloudfront.net/assets/images/book/lrg/9781/4493/9781449369415.jpg,4.34,392.0,Paperback,2016-10-21,"O'Reilly Media, Inc, USA",English,1449369413,9781449369415,Sebastopol,United States,178.0,233.0,17.78,589.67,2016,10
Mathematics for Machine Learning,"Marc Peter Deisenroth, A. Aldo Faisal, Cheng Soon Ong",1471.0,https://d1w7fb2mkkr3kw.cloudfront.net/assets/images/book/lrg/9781/1084/9781108455145.jpg,4.31,398.0,Paperback,2020-04-23,CAMBRIDGE UNIVERSITY PRESS,English,110845514X,9781108455145,Cambridge,United Kingdom,177.0,252.0,18.0,800.0,2020,4
Machine Learning : The New AI,Ethem Alpaydin,379.0,https://d1w7fb2mkkr3kw.cloudfront.net/assets/images/book/lrg/9780/2625/9780262529518.jpg,3.58,224.0,Paperback,2016-11-25,MIT Press Ltd,English,0262529513,9780262529518,Cambridge,United States,127.0,178.0,11.0,181.44,2016,11
"Python Machine Learning : Machine Learning and Deep Learning with Python, scikit-learn, and TensorFlow 2, 3rd Edition","Sebastian Raschka, Vahid Mirjalili",1310.0,https://d1w7fb2mkkr3kw.cloudfront.net/assets/images/book/lrg/9781/7899/9781789955750.jpg,4.28,770.0,Paperback,2019-12-12,Packt Publishing Limited,English,1789955750,9781789955750,Birmingham,United Kingdom,75.0,93.0,38.86,1297.27,2019,12
Python Machine Learning,Sebastian Raschka,1451.0,https://d1w7fb2mkkr3kw.cloudfront.net/assets/images/book/lrg/9781/7835/9781783555130.jpg,4.28,454.0,Paperback,2015-09-23,Packt Publishing Limited,English,1783555130,9781783555130,Birmingham,United Kingdom,191.0,235.0,23.37,775.64,2015,9
The Master Algorithm : How the Quest for the Ultimate Learning Machine Will Remake Our World,Pedro Domingos,364.0,https://d1w7fb2mkkr3kw.cloudfront.net/assets/images/book/lrg/9780/1419/9780141979243.jpg,3.78,352.0,Paperback,2017-01-26,Penguin Books Ltd,English,0141979240,9780141979243,London,United Kingdom,129.0,198.0,20.0,258.0,2017,1
Machine Learning For Dummies,"John Paul Mueller, Luca Massaron",580.0,https://d1w7fb2mkkr3kw.cloudfront.net/assets/images/book/lrg/9781/1192/9781119245513.jpg,3.48,432.0,Paperback,2016-05-31,Wiley,English,1119245516,9781119245513,New York,United States,186.0,245.0,23.0,584.0,2016,5
Python Machine Learning -,"Sebastian Raschka, Vahid Mirjalili",1246.0,https://d1w7fb2mkkr3kw.cloudfront.net/assets/images/book/lrg/9781/7871/9781787125933.jpg,4.27,622.0,Paperback,2017-09-20,Packt Publishing Limited,English,1787125939,9781787125933,Birmingham,United Kingdom,191.0,235.0,33.02,1088.62,2017,9
The Art of Statistics : Learning from Data,David Spiegelhalter,358.0,https://d1w7fb2mkkr3kw.cloudfront.net/assets/images/book/lrg/9780/2412/9780241258767.jpg,4.19,448.0,Paperback,2020-05-27,Penguin Books Ltd,English,0241258766,9780241258767,London,United Kingdom,111.0,181.0,25.0,258.0,2020,5
Machine Learning For Absolute Beginners : A Plain English Introduction,Oliver Theobald,586.0,https://d1w7fb2mkkr3kw.cloudfront.net/assets/images/book/lrg/9781/5496/9781549617218.jpg,3.88,162.0,Paperback,2018-01-01,Independently Published,English,1549617214,9781549617218,,,152.0,229.0,9.0,245.0,2018,1
Machine Learning with Python Cookbook,Chris Albon,1278.0,https://d1w7fb2mkkr3kw.cloudfront.net/assets/images/book/lrg/9781/4919/9781491989388.jpg,4.28,366.0,Paperback,2018-05-01,"O'Reilly Media, Inc, USA",English,1491989386,9781491989388,Sebastopol,United States,182.0,226.0,20.0,622.0,2018,5
"Machine Learning Design Patterns : Solutions to Common Challenges in Data Preparation, Model Building, and MLOps",Valliappa Lakshmanan,1170.0,https://d1w7fb2mkkr3kw.cloudfront.net/assets/images/book/lrg/9781/0981/9781098115784.jpg,3.17,400.0,Paperback,2020-11-10,"O'Reilly Media, Inc, USA",English,1098115783,9781098115784,Sebastopol,United States,178.0,233.0,21.34,648.64,2020,11
"Machine Learning for Algorithmic Trading : Predictive models to extract signals from market and alternative data for systematic trading strategies with Python, 2nd Edition",Stefan Jansen,1451.0,https://d1w7fb2mkkr3kw.cloudfront.net/assets/images/book/lrg/9781/8392/9781839217715.jpg,4.33,820.0,Paperback,2020-07-31,Packt Publishing Limited,English,1839217715,9781839217715,Birmingham,United Kingdom,75.0,93.0,41.4,1378.92,2020,7
Machine Learning : The Art and Science of Algorithms that Make Sense of Data,Peter Flach,1669.0,https://d1w7fb2mkkr3kw.cloudfront.net/assets/images/book/lrg/9781/1074/9781107422223.jpg,3.97,409.0,Paperback,2019-02-19,CAMBRIDGE UNIVERSITY PRESS,English,1107422221,9781107422223,Cambridge,United Kingdom,190.0,246.0,18.0,880.0,2019,2
Machine Learning for Hackers,Drew Conway,1073.0,https://d1w7fb2mkkr3kw.cloudfront.net/assets/images/book/mid/9781/4493/9781449303716.jpg,3.73,300.0,Paperback,2012-04-04,"O'Reilly Media, Inc, USA",English,1449303714,9781449303716,Sebastopol,United States,,,,,2012,4
Machine Learning Engineering,Andriy Burkov,1192.0,https://d1w7fb2mkkr3kw.cloudfront.net/assets/images/book/lrg/9781/9995/9781999579579.jpg,4.2,310.0,Paperback,2020-09-08,True Positive Inc.,English,1999579577,9781999579579,,,191.0,235.0,17.0,535.0,2020,9
Machine Learning for Asset Managers,Marcos M. López de Prado,645.0,https://d1w7fb2mkkr3kw.cloudfront.net/assets/images/book/lrg/9781/1087/9781108792899.jpg,4.36,152.0,Paperback,2020-04-30,CAMBRIDGE UNIVERSITY PRESS,English,1108792898,9781108792899,Cambridge,United Kingdom,152.0,230.0,12.0,250.0,2020,4
Machine Learning with Python for Everyone,Mark Fenner,1195.0,https://d1w7fb2mkkr3kw.cloudfront.net/assets/images/book/lrg/9780/1348/9780134845623.jpg,5.0,592.0,Paperback,2019-08-16,Pearson Education (US),English,0134845625,9780134845623,Boston,United States,180.0,230.0,30.0,914.0,2019,8
Building Machine Learning Powered Applications : Going from Idea to Product,Emmanuel Ameisen,1194.0,https://d1w7fb2mkkr3kw.cloudfront.net/assets/images/book/lrg/9781/4920/9781492045113.jpg,4.33,250.0,Paperback,2020-02-29,"O'Reilly Media, Inc, USA",English,149204511X,9781492045113,Sebastopol,United States,178.0,233.0,13.97,417.3,2020,2
Freehand Machine Embroidery : Learning to Draw with Your Sewing Machine,Poppy Treffry,570.0,https://d1w7fb2mkkr3kw.cloudfront.net/assets/images/book/lrg/9781/4463/9781446301869.jpg,4.15,128.0,Paperback,2012-07-29,DAVID & CHARLES,English,1446301869,9781446301869,Newton Abbot,United Kingdom,210.0,273.0,12.7,591.0,2012,7
Feature Engineering for Machine Learning,Alice Zheng,1245.0,https://d1w7fb2mkkr3kw.cloudfront.net/assets/images/book/lrg/9781/4919/9781491953242.jpg,3.81,218.0,Paperback,2018-04-20,"O'Reilly Media, Inc, USA",English,1491953241,9781491953242,Sebastopol,United States,179.0,232.0,12.0,418.0,2018,4
Machine Learning in Action,Peter Harrington,1381.0,https://d1w7fb2mkkr3kw.cloudfront.net/assets/images/book/lrg/9781/6172/9781617290183.jpg,3.77,384.0,Paperback,2012-04-24,Manning Publications,English,1617290181,9781617290183,"Shelter Island, N.Y.",United Kingdom,,,,,2012,4
Machine Learning with R,Brett Lantz,1587.0,https://d1w7fb2mkkr3kw.cloudfront.net/assets/images/book/lrg/9781/7843/9781784393908.jpg,4.26,452.0,Paperback,2015-07-31,Packt Publishing Limited,English,1784393908,9781784393908,Birmingham,United Kingdom,191.0,235.0,23.11,771.11,2015,7
Pattern Recognition and Machine Learning,Christopher M. Bishop,2300.0,https://d1w7fb2mkkr3kw.cloudfront.net/assets/images/book/lrg/9781/4939/9781493938438.jpg,4.3,738.0,Paperback,2016-08-23,Springer,English,1493938436,9781493938438,New York,United States,178.0,254.0,41.15,1921.0,2016,8
Artificial Intelligence and Machine Learning for Business : A No-Nonsense Guide to Data Driven Technologies,Steven Finlay,608.0,https://d1w7fb2mkkr3kw.cloudfront.net/assets/images/book/lrg/9781/9997/9781999730307.jpg,4.12,152.0,Paperback,2017-05-28,Relativistic,English,1999730305,9781999730307,,,140.0,213.0,10.0,181.0,2017,5
Introduction to Statistical Machine Learning,Masashi Sugiyama,2926.0,https://d1w7fb2mkkr3kw.cloudfront.net/assets/images/book/lrg/9780/1280/9780128021217.jpg,3.4,534.0,Paperback,2015-10-12,ELSEVIER SCIENCE & TECHNOLOGY,English,0128021217,9780128021217,San Francisco,United States,191.0,235.0,25.4,1110.0,2015,10
"Machine Learning with R : Expert techniques for predictive modeling, 3rd Edition",Brett Lantz,1282.0,https://d1w7fb2mkkr3kw.cloudfront.net/assets/images/book/lrg/9781/7882/9781788295864.jpg,4.0,458.0,Paperback,2019-04-15,Packt Publishing Limited,English,1788295862,9781788295864,Birmingham,United Kingdom,75.0,93.0,23.62,780.18,2019,4
Real-World Machine Learning,"Henrick Brink, Joesph Richards, Mark Fetherolf",1168.0,https://d1w7fb2mkkr3kw.cloudfront.net/assets/images/book/lrg/9781/6172/9781617291920.jpg,4.17,264.0,Paperback,2019-09-05,Manning Publications,English,1617291927,9781617291920,New York,United States,190.0,235.0,10.0,452.0,2019,9
Approaching (Almost) Any Machine Learning Problem,Abhishek Thakur,608.0,https://d1w7fb2mkkr3kw.cloudfront.net/assets/images/book/lrg/9788/2692/9788269211504.jpg,4.24,302.0,Paperback,2020-06-30,Abhishek Thakur,English,8269211508,9788269211504,,,152.0,229.0,16.0,404.0,2020,6
Machine Learning : New and Collected Stories,Hugh Howey,447.0,https://d1w7fb2mkkr3kw.cloudfront.net/assets/images/book/lrg/9781/3287/9781328767523.jpg,4.05,352.0,Paperback,2017-10-03,Houghton Mifflin Harcourt Publishing Company,English,1328767523,9781328767523,Boston,United States,135.0,203.0,23.0,272.0,2017,10
Building Machine Learning Pipelines : Automating Model Life Cycles with Tensorflow,"Hannes Hapke, Catherine Nelson",1348.0,https://d1w7fb2mkkr3kw.cloudfront.net/assets/images/book/lrg/9781/4920/9781492053194.jpg,3.57,366.0,Paperback,2020-08-31,"O'Reilly Media, Inc, USA",English,1492053198,9781492053194,Sebastopol,United States,178.0,233.0,19.0,581.0,2020,8
Data Mining : Practical Machine Learning Tools and Techniques,"Ian H. Witten, Eibe Frank, Mark A. Hall, Christopher J. Pal",1661.0,https://d1w7fb2mkkr3kw.cloudfront.net/assets/images/book/lrg/9780/1280/9780128042915.jpg,3.89,654.0,Paperback,2017-01-01,ELSEVIER SCIENCE & TECHNOLOGY,English,0128042915,9780128042915,San Francisco,United States,191.0,235.0,27.94,1250.0,2017,1
Practical Machine Learning in JavaScript : TensorFlow.js for Web Developers,Charlie Gerard,1026.0,https://d1w7fb2mkkr3kw.cloudfront.net/assets/images/book/lrg/9781/4842/9781484264171.jpg,5.0,323.0,Paperback,2020-12-01,aPress,English,1484264177,9781484264171,Berkley,United States,155.0,235.0,18.03,522.0,2020,12
Machine Learning with TensorFlow,Nishant Shukla,959.0,https://d1w7fb2mkkr3kw.cloudfront.net/assets/images/book/lrg/9781/6172/9781617293870.jpg,3.43,272.0,Paperback,2019-09-05,Manning Publications,English,1617293873,9781617293870,New York,United States,190.0,235.0,10.0,454.0,2019,9
AI and Machine Learning For Coders : A Programmer's Guide to Artificial Intelligence,Laurence Moroney,1309.0,https://d1w7fb2mkkr3kw.cloudfront.net/assets/images/book/lrg/9781/4920/9781492078197.jpg,,300.0,Paperback,2020-11-30,"O'Reilly Media, Inc, USA",English,1492078190,9781492078197,Sebastopol,United States,178.0,233.0,26.92,621.42,2020,11
Machine Learning Pocket Reference : Working with Structured Data in Python,Matt Harrison,563.0,https://d1w7fb2mkkr3kw.cloudfront.net/assets/images/book/lrg/9781/4920/9781492047544.jpg,4.0,200.0,Paperback,2019-10-31,O'Reilly UK Limited,English,1492047546,9781492047544,Farnham,United Kingdom,,,,,2019,10
Hands-On Machine Learning for Algorithmic Trading : Design and implement investment strategies based on smart algorithms that learn from data using Python,Stefan Jansen,1496.0,https://d1w7fb2mkkr3kw.cloudfront.net/assets/images/book/lrg/9781/7893/9781789346411.jpg,3.71,684.0,Paperback,2018-12-31,Packt Publishing Limited,English,178934641X,9781789346411,Birmingham,United Kingdom,75.0,93.0,34.8,1156.66,2018,12
Practical Time Series Analysis : Prediction with Statistics and Machine Learning,Aileen Nielsen,1072.0,https://d1w7fb2mkkr3kw.cloudfront.net/assets/images/book/lrg/9781/4920/9781492041658.jpg,3.87,400.0,Paperback,2019-11-30,"O'Reilly Media, Inc, USA",English,1492041653,9781492041658,Sebastopol,United States,178.0,233.0,25.4,771.11,2019,11
Machine Learning with R,Brett Lantz,1533.0,https://d1w7fb2mkkr3kw.cloudfront.net/assets/images/book/lrg/9781/7821/9781782162148.jpg,4.22,396.0,Paperback,2013-10-31,Packt Publishing Limited,English,1782162143,9781782162148,Birmingham,United Kingdom,191.0,235.0,20.57,675.85,2013,10
Machine Learning for Kids (Tinker Toddlers),Dr Dhoot,323.0,https://d1w7fb2mkkr3kw.cloudfront.net/assets/images/book/lrg/9781/7325/9781732508002.jpg,3.2,36.0,Paperback,2019-02-08,Tinker Toddlers,English,1732508003,9781732508002,,,216.0,216.0,2.0,109.0,2019,2
Introduction to Machine Learning with R,Burger Scott,1065.0,https://d1w7fb2mkkr3kw.cloudfront.net/assets/images/book/lrg/9781/4919/9781491976449.jpg,3.38,200.0,Paperback,2018-04-10,"O'Reilly Media, Inc, USA",English,1491976446,9781491976449,Sebastopol,United States,178.0,233.0,12.0,410.0,2018,4
Machine Learning and Security,"Clarence Chio, David Freeman",1328.0,https://d1w7fb2mkkr3kw.cloudfront.net/assets/images/book/lrg/9781/4919/9781491979907.jpg,3.7,370.0,Paperback,2018-03-01,"O'Reilly Media, Inc, USA",English,1491979909,9781491979907,Sebastopol,United States,178.0,232.0,20.0,680.0,2018,3
Machine Learning and Human Intelligence : The future of education for the 21st century,Rosemary Luckin,733.0,https://d1w7fb2mkkr3kw.cloudfront.net/assets/images/book/lrg/9781/7827/9781782772514.jpg,3.0,160.0,Paperback,2018-07-27,Institute of Education Press,English,1782772510,9781782772514,London,United Kingdom,156.0,234.0,10.16,294.84,2018,7
Statistical Regression and Classification : From Linear Models to Machine Learning,Norman Matloff,2294.0,https://d1w7fb2mkkr3kw.cloudfront.net/assets/images/book/lrg/9781/4987/9781498710916.jpg,3.0,490.0,Paperback,2017-08-31,Taylor & Francis,English,1498710913,9781498710916,Portland,United States,156.0,235.0,27.94,658.0,2017,8
Advanced Machine Learning with Python,John Hearty,1361.0,https://d1w7fb2mkkr3kw.cloudfront.net/assets/images/book/lrg/9781/7843/9781784398637.jpg,3.36,278.0,Paperback,2016-07-29,Packt Publishing Limited,English,1784398632,9781784398637,Birmingham,United Kingdom,191.0,235.0,14.73,480.81,2016,7
Machine Learning for Absolute Beginners : A Plain English Introduction,Oliver Theobald,535.0,https://d1w7fb2mkkr3kw.cloudfront.net/assets/images/book/lrg/9781/5209/9781520951409.jpg,3.93,168.0,Paperback,2017-04-03,Independently Published,English,152095140X,9781520951409,,,152.0,229.0,10.0,254.0,2017,4
"Machine Learning Mathematics : Study Deep Learning Through Data Science. How to Build Artificial Intelligence Through Concepts of Statistics, Algorithms, Analysis and Data Mining",Samuel Hack,639.0,https://d1w7fb2mkkr3kw.cloudfront.net/assets/images/book/lrg/9781/6997/9781699742150.jpg,4.2,108.0,Paperback,2019-10-14,Independently Published,English,1699742154,9781699742150,,,152.0,229.0,6.0,154.0,2019,10
Statistical Modeling and Machine Learning for Molecular Biology,Alan Moses,1944.0,https://d1w7fb2mkkr3kw.cloudfront.net/assets/images/book/lrg/9781/4822/9781482258592.jpg,4.0,264.0,Paperback,2016-12-22,Apple Academic Press Inc.,English,1482258595,9781482258592,Oakville,Canada,156.0,235.0,15.24,408.0,2016,12
"Applied Machine Learning for Health and Fitness : A Practical Guide to Machine Learning with Deep Vision, Sensors and IoT",Kevin Ashley,1061.0,https://d1w7fb2mkkr3kw.cloudfront.net/assets/images/book/lrg/9781/4842/9781484257715.jpg,2.0,259.0,Paperback,2020-08-25,aPress,English,1484257715,9781484257715,Berkley,United States,155.0,235.0,14.73,427.0,2020,8
Building Machine Learning Systems with Python,"Willi Richert, Luis Pedro Coelho",1368.0,https://d1w7fb2mkkr3kw.cloudfront.net/assets/images/book/lrg/9781/7821/9781782161400.jpg,3.89,290.0,Paperback,2013-08-02,Packt Publishing Limited,English,1782161406,9781782161400,Birmingham,United Kingdom,191.0,235.0,15.49,503.49,2013,8
Learn Data Mining Through Excel : A Step-by-Step Approach for Understanding Machine Learning Methods,Hong Zhou,1050.0,https://d1w7fb2mkkr3kw.cloudfront.net/assets/images/book/lrg/9781/4842/9781484259818.jpg,4.0,219.0,Paperback,2020-06-14,aPress,English,1484259815,9781484259818,Berkley,United States,178.0,254.0,12.7,456.0,2020,6
Machine Learning for Finance : Principles and practice for financial insiders,Jannes Klaas,1310.0,https://d1w7fb2mkkr3kw.cloudfront.net/assets/images/book/lrg/9781/7891/9781789136364.jpg,4.0,456.0,Paperback,2019-05-30,Packt Publishing Limited,English,1789136369,9781789136364,Birmingham,United Kingdom,75.0,93.0,23.37,775.64,2019,5
Mastering Azure Machine Learning : Perform large-scale end-to-end advanced machine learning in the cloud with Microsoft Azure Machine Learning,"Christoph Koerner, Kaijisse Waaijer",1451.0,https://d1w7fb2mkkr3kw.cloudfront.net/assets/images/book/lrg/9781/7898/9781789807554.jpg,,436.0,Paperback,2020-04-30,Packt Publishing Limited,English,1789807557,9781789807554,Birmingham,United Kingdom,75.0,93.0,22.61,743.89,2020,4
Machine Learning Using R : With Time Series and Industry-Based Use Cases in R,"Karthik Ramasubramanian, Abhishek Singh",986.0,https://d1w7fb2mkkr3kw.cloudfront.net/assets/images/book/lrg/9781/4842/9781484242148.jpg,2.0,700.0,Paperback,2019-02-01,aPress,English,1484242149,9781484242148,Berkley,United States,178.0,254.0,36.83,1355.0,2019,2
Hands-On Unsupervised Learning Using Python : How to Build Applied Machine Learning Solutions from Unlabeled Data,Ankur A. Patel,1468.0,https://d1w7fb2mkkr3kw.cloudfront.net/assets/images/book/lrg/9781/4920/9781492035640.jpg,3.71,400.0,Paperback,2019-03-26,"O'Reilly Media, Inc, USA",English,1492035645,9781492035640,Sebastopol,United States,150.0,250.0,15.0,666.0,2019,3
Practical Machine Learning in R,"Fred Nwanganga, Mike Chapple",791.0,https://d1w7fb2mkkr3kw.cloudfront.net/assets/images/book/lrg/9781/1195/9781119591511.jpg,5.0,464.0,Paperback,2020-05-27,Wiley,English,1119591511,9781119591511,New York,United States,188.0,233.0,22.0,920.0,2020,5
Machine Learning with Python : A Practical Beginners' Guide,Oliver Theobald,501.0,https://d1w7fb2mkkr3kw.cloudfront.net/assets/images/book/lrg/9781/6866/9781686658495.jpg,3.91,154.0,Paperback,2019-10-15,Independently Published,English,1686658494,9781686658495,,,152.0,229.0,9.0,236.0,2019,10
Learning to Use Statistical Tests in Psychology,"Judith Greene, Manuela D'Oliveira",1276.0,https://d1w7fb2mkkr3kw.cloudfront.net/assets/images/book/lrg/9780/3352/9780335216802.jpg,4.0,232.0,Paperback,2006-03-31,OPEN UNIVERSITY PRESS,English,0335216803,9780335216802,Milton Keynes,United Kingdom,171.0,240.0,15.0,447.0,2006,3
"Machine Learning with Python : Learn the art of Programming with a complete crash course for beginners. Strategies to Master Data Science, Numpy, Keras, Pandas and Arduino like a Pro in 7 days",Jason Test,681.0,https://d1w7fb2mkkr3kw.cloudfront.net/assets/images/book/lrg/9798/6767/9798676790684.jpg,,250.0,Paperback,2020-08-19,Independently Published,English,,9798676790684,,,152.0,229.0,13.0,340.0,2020,8
Machine Learning in Business : An Introduction to the World of Data Science,John C Hull,992.0,https://d1w7fb2mkkr3kw.cloudfront.net/assets/images/book/lrg/9798/6440/9798644074372.jpg,3.75,276.0,Paperback,2020-05-08,Independently Published,English,,9798644074372,,,152.0,229.0,15.0,372.0,2020,5
Natural Language Annotation for Machine Learning,James Pustejovsky,932.0,https://d1w7fb2mkkr3kw.cloudfront.net/assets/images/book/lrg/9781/4493/9781449306663.jpg,3.54,350.0,Paperback,2012-11-20,"O'Reilly Media, Inc, USA",English,1449306667,9781449306663,Sebastopol,United States,,,,,2012,11
MATLAB Machine Learning Recipes : A Problem-Solution Approach,"Michael Paluszek, Stephanie Thomas",740.0,https://d1w7fb2mkkr3kw.cloudfront.net/assets/images/book/lrg/9781/4842/9781484239155.jpg,,347.0,Paperback,2019-07-01,aPress,English,1484239156,9781484239155,Berkley,United States,178.0,254.0,19.3,699.0,2019,7
Tinyml : Machine Learning with Tensorflow Lite on Arduino and Ultra-Low-Power Microcontrollers,"Pete Warden, Daniel Situnayake",1085.0,https://d1w7fb2mkkr3kw.cloudfront.net/assets/images/book/lrg/9781/4920/9781492052043.jpg,4.44,504.0,Paperback,2020-01-03,"O'Reilly Media, Inc, USA",English,1492052043,9781492052043,Sebastopol,United States,178.0,233.0,26.0,794.0,2020,1
Mastering Machine Learning Algorithms : Expert techniques to implement popular machine learning algorithms and fine-tune your models,Giuseppe Bonaccorso,1451.0,https://d1w7fb2mkkr3kw.cloudfront.net/assets/images/book/mid/9781/7886/9781788621113.jpg,5.0,576.0,Paperback,2018-05-25,Packt Publishing Limited,English,1788621115,9781788621113,Birmingham,United Kingdom,75.0,93.0,29.72,975.22,2018,5
