Python 3 for Machine Learning,Oswald Campesato,1286.0,https://d1w7fb2mkkr3kw.cloudfront.net/assets/images/book/lrg/9781/6839/9781683924951.jpg,,200.0,Paperback,2020-03-27,Mercury Learning & Information,English,1683924959,9781683924951,,,178.0,229.0,22.86,521.63,2020,3
"Machine Learning with Python : The Ultimate Guide for Absolute Beginners with Steps to Implement Artificial Neural Networks with Real Examples (Useful Python Tools eg. Anaconda, Jupiter Notebook)",Daniel Geron,627.0,https://d1w7fb2mkkr3kw.cloudfront.net/assets/images/book/lrg/9781/0814/9781081474003.jpg,3.17,184.0,Paperback,2019-07-19,Independently Published,English,1081474009,9781081474003,,,152.0,229.0,10.0,254.0,2019,7
Machine Learning for beginners : Azure AI,Uditha Bandara,515.0,https://d1w7fb2mkkr3kw.cloudfront.net/assets/images/book/lrg/9781/6868/9781686820359.jpg,,68.0,Paperback,2019-08-16,Independently Published,English,1686820356,9781686820359,,,152.0,229.0,5.0,141.0,2019,8
Applied Machine Learning with Python,Andrea Giussani,1263.0,https://d1w7fb2mkkr3kw.cloudfront.net/assets/images/book/lrg/9788/8313/9788831322041.jpg,4.0,164.0,Paperback,2020-04-30,Bocconi University Press,English,8831322044,9788831322041,,,171.0,241.0,12.7,340.19,2020,4
An Introduction to Machine Learning,"Gopinath Rebala, Ajay Ravi, Sanjay Churiwala",2923.0,https://d1w7fb2mkkr3kw.cloudfront.net/assets/images/book/lrg/9783/0301/9783030157319.jpg,4.0,288.0,Paperback,2019-06-04,Springer,English,3030157318,9783030157319,,,156.0,234.0,15.0,408.0,2019,6
Microsoft Azure Machine Learning,Sumit Mund,1179.0,https://d1w7fb2mkkr3kw.cloudfront.net/assets/images/book/lrg/9781/7843/9781784390792.jpg,3.89,212.0,Paperback,2015-06-19,Packt Publishing Limited,English,1784390798,9781784390792,Birmingham,United Kingdom,191.0,235.0,11.43,371.95,2015,6
The Machine Learning Toolbox : For Non-Mathematicians,Brian Letort,665.0,https://d1w7fb2mkkr3kw.cloudfront.net/assets/images/book/lrg/9781/7943/9781794302686.jpg,,182.0,Paperback,2019-01-18,Independently Published,English,1794302689,9781794302686,,,127.0,203.0,10.0,186.0,2019,1
Machine Learning For Beginners,Jonathan S Walker,365.0,https://d1w7fb2mkkr3kw.cloudfront.net/assets/images/book/lrg/9789/8149/9789814950626.jpg,,102.0,Paperback,2021-01-18,Jw Choices,English,9814950629,9789814950626,,,152.0,229.0,5.0,145.0,2021,1
"Practical Machine Learning with AWS : Process, Build, Deploy, and Productionize Your Models Using AWS",Himanshu Singh,1495.0,https://d1w7fb2mkkr3kw.cloudfront.net/assets/images/book/lrg/9781/4842/9781484262214.jpg,,241.0,Paperback,2020-11-24,aPress,English,1484262212,9781484262214,Berkley,United States,178.0,254.0,13.97,500.0,2020,11
Multimodal Machine Learning : Techniques and Applications,"Santosh Kumar, Sanjay Kumar Singh",3143.0,https://d1w7fb2mkkr3kw.cloudfront.net/assets/images/book/lrg/9780/1282/9780128237373.jpg,,375.0,Paperback,2021-05-01,Elsevier Science Publishing Co Inc,English,0128237376,9780128237373,San Diego,United States,,,,,2021,5
python machine learning,Tony F Charles,603.0,https://d1w7fb2mkkr3kw.cloudfront.net/assets/images/book/lrg/9781/8010/9781801098014.jpg,,258.0,Paperback,2020-10-07,Tony F. Charles,English,1801098018,9781801098014,,,152.0,229.0,14.0,349.0,2020,10
Automated Machine Learning,"Joaquin Vanschoren, Lars Kotthoff, Frank Hutter",1253.0,https://d1w7fb2mkkr3kw.cloudfront.net/assets/images/book/lrg/9781/0132/9781013271663.jpg,,222.0,Paperback,2020-10-08,Saint Philip Street Press,English,1013271661,9781013271663,,,216.0,279.0,12.0,526.0,2020,10
Machine Learning and Information Processing : Proceedings of ICMLIP 2020,"Debabala Swain, Prasant Kumar Pattnaik, Tushar Athawale",6286.0,https://d1w7fb2mkkr3kw.cloudfront.net/assets/images/book/lrg/9789/8133/9789813348585.jpg,,486.0,Paperback,2021-03-03,Springer,English,9813348585,9789813348585,Singapore,Singapore,,,,,2021,3
Evolutionary Machine Learning Techniques : Algorithms and Applications,"Seyedali Mirjalili, Hossam Faris, Ibrahim Aljarah",4120.0,https://d1w7fb2mkkr3kw.cloudfront.net/assets/images/book/lrg/9789/8132/9789813299924.jpg,,286.0,Paperback,2020-11-25,Springer,English,9813299924,9789813299924,Singapore,Singapore,155.0,235.0,15.75,456.0,2020,11
Algorithms in Machine Learning Paradigms,"JYOTSNA KUMAR MANDAL, Somnath Mukhopadhyay, Paramartha Dutta, Kousik Dasgupta",3520.0,https://d1w7fb2mkkr3kw.cloudfront.net/assets/images/book/lrg/9789/8115/9789811510434.jpg,,195.0,Paperback,2021-01-18,Springer,English,9811510431,9789811510434,Singapore,Singapore,155.0,235.0,11.0,324.0,2021,1
Machine Learning With Python,Eric Chamberlin,608.0,https://d1w7fb2mkkr3kw.cloudfront.net/assets/images/book/lrg/9781/8010/9781801098243.jpg,,184.0,Paperback,2020-10-07,Davide Cicatiello,English,1801098247,9781801098243,,,152.0,229.0,10.0,254.0,2020,10
Industrial Machine Learning : Using Artificial Intelligence as a Transformational Disruptor,Andreas Francois Vermeulen,951.0,https://d1w7fb2mkkr3kw.cloudfront.net/assets/images/book/lrg/9781/4842/9781484253151.jpg,,637.0,Paperback,2019-12-09,aPress,English,1484253159,9781484253151,Berkley,United States,178.0,254.0,33.78,1244.0,2019,12
Data Science with Machine Learning - : Python Interview Questions,Vishwanathan Narayanan,434.0,https://d1w7fb2mkkr3kw.cloudfront.net/assets/images/book/lrg/9789/3881/9789388176637.jpg,,146.0,Paperback,2019-09-04,BPB Publications,English,9388176634,9789388176637,New Delhi,India,,,,,2019,9
Machine Learning & Artificial Intelligence : Assessing External Cyber Threats,Yuk Kuen Wong,587.0,https://d1w7fb2mkkr3kw.cloudfront.net/assets/images/book/lrg/9798/6923/9798692312143.jpg,,34.0,Paperback,2020-10-01,Independently Published,English,,9798692312143,,,152.0,229.0,2.0,59.0,2020,10
"Machine Learning in Medical Imaging : 7th International Workshop, MLMI 2016, Held in Conjunction with MICCAI 2016, Athens, Greece, October 17, 2016, Proceedings","Li Wang, Ehsan Adeli, Qian Wang, Yinghuan Shi, Heung-Il Suk",2519.0,https://d1w7fb2mkkr3kw.cloudfront.net/assets/images/book/lrg/9783/3194/9783319471563.jpg,,324.0,Paperback,2016-10-01,Springer,English,3319471562,9783319471563,Cham,Switzerland,155.0,235.0,18.03,5153.0,2016,10
Advances in Machine Learning Research,Sharad Shandilya,2680.0,https://d1w7fb2mkkr3kw.cloudfront.net/assets/images/book/lrg/9781/6332/9781633212091.jpg,,107.0,Paperback,2014-09-01,Nova Science Publishers Inc,English,1633212092,9781633212091,New York,United States,152.0,229.0,6.35,240.0,2014,9
"Machine Learning and Cybernetics : 13th International Conference, Lanzhou, China, July 13-16, 2014. Proceedings","Xizhao Wang, Witold Pedrycz, Patrick Chan, Qiang He",2714.0,https://d1w7fb2mkkr3kw.cloudfront.net/assets/images/book/lrg/9783/6624/9783662456514.jpg,,462.0,Paperback,2014-12-17,Springer,English,3662456516,9783662456514,Berlin,Germany,155.0,235.0,24.38,7139.0,2014,12
Machine Learning with Python : The Basics,David V,406.0,https://d1w7fb2mkkr3kw.cloudfront.net/assets/images/book/lrg/9781/5449/9781544933498.jpg,3.0,84.0,Paperback,2017-04-13,Createspace Independent Publishing Platform,English,1544933495,9781544933498,,,152.0,229.0,4.0,122.0,2017,4
Machine Learning with R Cookbook -,"AshishSingh Bhatia, Chiu (David  Yu-Wei Chiu)",1591.0,https://d1w7fb2mkkr3kw.cloudfront.net/assets/images/book/mid/9781/7872/9781787284395.jpg,3.0,572.0,Paperback,2017-10-23,Packt Publishing Limited,English,1787284395,9781787284395,Birmingham,United Kingdom,191.0,235.0,29.46,970.69,2017,10
Machine Learning Paradigms : Applications in Recommender Systems,"Aristomenis S. Lampropoulos, George A. Tsihrintzis",3247.0,https://d1w7fb2mkkr3kw.cloudfront.net/assets/images/book/lrg/9783/3193/9783319384962.jpg,,125.0,Paperback,2016-11-04,Springer,English,3319384961,9783319384962,Cham,Switzerland,155.0,235.0,7.87,2292.0,2016,11
Python Machine Learning Cookbook,Prateek Joshi,1744.0,https://d1w7fb2mkkr3kw.cloudfront.net/assets/images/book/lrg/9781/7864/9781786464477.jpg,2.5,304.0,Paperback,2016-06-23,Packt Publishing Limited,English,1786464470,9781786464477,Birmingham,United Kingdom,191.0,235.0,16.26,526.17,2016,6
"Machine Learning and Intelligent Communications : Second International Conference, MLICOM 2017, Weihai, China, August 5-6, 2017, Proceedings, Part I","Xuemai Gu, Gongliang Liu, Bo Li",2702.0,https://d1w7fb2mkkr3kw.cloudfront.net/assets/images/book/lrg/9783/3197/9783319735634.jpg,5.0,715.0,Paperback,2018-02-23,Springer,English,3319735632,9783319735634,Cham,Switzerland,155.0,235.0,37.59,1122.0,2018,2
Source Separation and Machine Learning,Jen-Tzung Chien,2416.0,https://d1w7fb2mkkr3kw.cloudfront.net/assets/images/book/lrg/9780/1281/9780128177969.jpg,,384.0,Paperback,2018-10-23,Elsevier Science Publishing Co Inc,English,0128177969,9780128177969,San Diego,United States,191.0,235.0,20.07,730.0,2018,10
Machine Learning Guide : Practical Approach for Business,Simone Capostagno,444.0,https://d1w7fb2mkkr3kw.cloudfront.net/assets/images/book/lrg/9781/7224/9781722486143.jpg,4.5,46.0,Paperback,2018-07-05,Createspace Independent Publishing Platform,English,1722486147,9781722486143,,,152.0,229.0,3.0,77.0,2018,7
Monetizing Machine Learning : Quickly Turn Python ML Ideas into Web Applications on the Serverless Cloud,"Manuel Amunategui, Mehdi Roopaei",1001.0,https://d1w7fb2mkkr3kw.cloudfront.net/assets/images/book/lrg/9781/4842/9781484238721.jpg,3.0,482.0,Paperback,2018-12-01,aPress,English,1484238729,9781484238721,Berkley,United States,178.0,254.0,26.92,986.0,2018,12
Machine Learning on Data Lake,Nataliya Boyko,1620.0,https://d1w7fb2mkkr3kw.cloudfront.net/assets/images/book/lrg/9786/1398/9786139836680.jpg,,188.0,Paperback,2018-07-16,LAP Lambert Academic Publishing,English,6139836689,9786139836680,,,152.0,229.0,11.0,281.0,2018,7
Machine Learning for Hackers : R and Jupyter Notebooks,Isabella Romeo,861.0,https://d1w7fb2mkkr3kw.cloudfront.net/assets/images/book/lrg/9780/9966/9780996686044.jpg,,284.0,Paperback,2018-07-14,Sherwood Forest Books,English,0996686045,9780996686044,,,178.0,254.0,15.0,494.0,2018,7
That Book on AI and Machine Learning : A One-Hour Intro,"Bobby Timberlake, Jonathan B Morley",360.0,https://d1w7fb2mkkr3kw.cloudfront.net/assets/images/book/lrg/9781/7931/9781793145147.jpg,,132.0,Paperback,2020-01-01,Independently Published,English,1793145148,9781793145147,,,127.0,203.0,7.0,136.0,2020,1
"Machine Learning in Medical Imaging : 11th International Workshop, MLMI 2020, Held in Conjunction with MICCAI 2020, Lima, Peru, October 4, 2020, Proceedings","Mingxia Liu, Pingkun Yan, Chunfeng Lian, Xiaohuan Cao",3163.0,https://d1w7fb2mkkr3kw.cloudfront.net/assets/images/book/lrg/9783/0305/9783030598600.jpg,,686.0,Paperback,2020-12-05,Springer,English,3030598608,9783030598600,Cham,Switzerland,155.0,235.0,35.81,1062.0,2020,12
"Computational Intelligence and Machine Learning : Proceedings of the 7th International Conference on Advanced Computing, Networking, and Informatics (ICACNI 2019)","JYOTSNA KUMAR MANDAL, Imon Mukherjee, Sambit Bakshi, Sanjay Chatterji, Pankaj K. Sa",7210.0,https://d1w7fb2mkkr3kw.cloudfront.net/assets/images/book/lrg/9789/8115/9789811586095.jpg,,200.0,Paperback,2021-01-30,Springer,English,9811586098,9789811586095,Singapore,Singapore,155.0,235.0,11.43,332.0,2021,1
Machine Learning in Python : A Dive Into Depths Of Python - Ultimate Guide For Beginners To Improve Their Skills,Sarah Andreas,639.0,https://d1w7fb2mkkr3kw.cloudfront.net/assets/images/book/lrg/9798/6028/9798602845631.jpg,,132.0,Paperback,2020-01-23,Independently Published,English,,9798602845631,,,127.0,203.0,7.0,136.0,2020,1
Optimization in Machine Learning and Applications,"Anand J. Kulkarni, Suresh Chandra Satapathy",1693.0,https://d1w7fb2mkkr3kw.cloudfront.net/assets/images/book/lrg/9789/8115/9789811509964.jpg,,197.0,Paperback,2020-12-10,Springer,English,9811509964,9789811509964,Singapore,Singapore,155.0,235.0,11.18,326.0,2020,12
Machine Learning Book Python : The Perfect Handbook For Building A Top-Notch Code In Scratch And Using Python Data Science Programming To Elevate Your Skills Out Of The Ordinary,Michael and Eric Scratch,500.0,https://d1w7fb2mkkr3kw.cloudfront.net/assets/images/book/lrg/9781/8013/9781801326957.jpg,,116.0,Paperback,2020-11-25,Luca Pino,English,1801326959,9781801326957,,,152.0,229.0,6.0,163.0,2020,11
"Advances in Machine Learning and Cybernetics : 4th International Conference, ICMLC 2005, Guangzhou, China, August 18-21, 2005, Revised Selected Papers","Daniel S. Yeung, Zhi-Qiang Liu, Xi-zhao Wang, Hong Yan",4286.0,https://d1w7fb2mkkr3kw.cloudfront.net/assets/images/book/lrg/9783/5403/9783540335849.jpg,,1110.0,Paperback,2009-05-26,Springer,English,3540335846,9783540335849,Berlin,Germany,155.0,235.0,56.64,1682.0,2009,5
Machine Learning in Concrete Technology,"Pijush Samui, S K Sekar, Kallyan Kulkarni",1301.0,https://d1w7fb2mkkr3kw.cloudfront.net/assets/images/book/lrg/9783/6393/9783639356847.jpg,,84.0,Paperback,2011-05-11,VDM Verlag,English,3639356845,9783639356847,,,152.0,229.0,5.0,136.0,2011,5
"Machine Learning in Medical Imaging : Second International Workshop, MLMI 2011, Held in Conjunction with MICCAI 2011, Toronto, Canada, September 18, 2011, Proceedings","Kenji Suzuki, Fei Wang, Dinggang Shen, Pingkun Yan",2129.0,https://d1w7fb2mkkr3kw.cloudfront.net/assets/images/book/lrg/9783/6422/9783642243189.jpg,,371.0,Paperback,2011-11-03,Springer,English,3642243185,9783642243189,Berlin,Germany,155.0,235.0,22.86,586.0,2011,11
Machine Learning in Agroecology,Aneta Trajanov,1571.0,https://d1w7fb2mkkr3kw.cloudfront.net/assets/images/book/lrg/9783/8454/9783845471334.jpg,,140.0,Paperback,2011-09-20,LAP Lambert Academic Publishing,English,3845471336,9783845471334,,,152.0,229.0,8.0,213.0,2011,9
Statistical Learning and Data Science,"Mireille Gettler Summa, Leon Bottou, Bernard Goldfarb, Fionn Murtagh, Catherine Pardoux, Myriam Touati",1769.0,https://d1w7fb2mkkr3kw.cloudfront.net/assets/images/book/lrg/9780/3673/9780367381899.jpg,3.0,243.0,Paperback,2019-09-25,Taylor & Francis,English,0367381893,9780367381899,London,United Kingdom,178.0,254.0,17.78,476.0,2019,9
Statistical Learning of Complex Data,"Francesca Greselin, Laura Deldossi, Luca Bagnato, Maurizio Vichi",3022.0,https://d1w7fb2mkkr3kw.cloudfront.net/assets/images/book/lrg/9783/0302/9783030211394.jpg,,201.0,Paperback,2019-10-30,Springer,English,3030211398,9783030211394,Cham,Switzerland,155.0,235.0,11.68,338.0,2019,10
The Business of Machine Learning : A Technical Decision Maker's Guide to Communication and Strategy,"Josh Holmes, Michael Lanzetta",1508.0,https://d1w7fb2mkkr3kw.cloudfront.net/assets/images/book/lrg/9781/4842/9781484235423.jpg,,230.0,Paperback,2021-07-01,aPress,English,1484235428,9781484235423,Berkley,United States,,,,,2021,7
Machine Learning With Go,Daniel Whitenack,1591.0,https://d1w7fb2mkkr3kw.cloudfront.net/assets/images/book/lrg/9781/7858/9781785882104.jpg,3.38,304.0,Paperback,2017-09-26,Packt Publishing Limited,English,1785882104,9781785882104,Birmingham,United Kingdom,191.0,235.0,16.26,526.17,2017,9
Machine Learning for Planetary Science,"Joern Helbert, Mario D'Amore, Michael Aye, Hannah Kerner",4275.0,https://d1w7fb2mkkr3kw.cloudfront.net/assets/images/book/lrg/9780/1281/9780128187210.jpg,,400.0,Paperback,2021-06-01,Elsevier Science Publishing Co Inc,English,0128187212,9780128187210,,,,,,,2021,6
"Machine Learning for Networking : First International Conference, MLN 2018, Paris, France, November 27-29, 2018, Revised Selected Papers","Eric Renault, Paul Mühlethaler, Selma Boumerdassi",2311.0,https://d1w7fb2mkkr3kw.cloudfront.net/assets/images/book/lrg/9783/0301/9783030199449.jpg,,388.0,Paperback,2019-05-10,Springer,English,3030199444,9783030199449,Cham,Switzerland,155.0,235.0,21.08,617.0,2019,5
Machine Learning with SAS : Special Collection,Saratendu Sethi,486.0,https://d1w7fb2mkkr3kw.cloudfront.net/assets/images/book/mid/9781/6429/9781642954760.jpg,,168.0,Paperback,2019-06-21,SAS Institute,English,1642954764,9781642954760,,,216.0,279.0,9.0,404.0,2019,6
"Machine Learning in Medical Imaging : 10th International Workshop, MLMI 2019, Held in Conjunction with MICCAI 2019, Shenzhen, China, October 13, 2019, Proceedings","Heung-Il Suk, Mingxia Liu, Pingkun Yan, Chunfeng Lian",2358.0,https://d1w7fb2mkkr3kw.cloudfront.net/assets/images/book/lrg/9783/0303/9783030326913.jpg,,695.0,Paperback,2019-10-10,Springer,English,3030326918,9783030326913,Cham,Switzerland,155.0,235.0,36.32,1080.0,2019,10
Machine Learning Applications,"Dr Sapna Singh, Dr Mohit Gangwar",1818.0,https://d1w7fb2mkkr3kw.cloudfront.net/assets/images/book/lrg/9786/2026/9786202675109.jpg,,92.0,Paperback,2020-10-20,LAP Lambert Academic Publishing,English,6202675101,9786202675109,,,152.0,229.0,6.0,145.0,2020,10
Machine Learning with the Raspberry Pi : Experiments with Data and Computer Vision,Donald J. Norris,762.0,https://d1w7fb2mkkr3kw.cloudfront.net/assets/images/book/lrg/9781/4842/9781484251737.jpg,3.0,568.0,Paperback,2019-12-13,aPress,English,1484251733,9781484251737,Berkley,United States,155.0,235.0,29.72,878.0,2019,12
Machine Learning for iOS Developers,Abhishek Mishra,641.0,https://d1w7fb2mkkr3kw.cloudfront.net/assets/images/book/lrg/9781/1196/9781119602873.jpg,,336.0,Paperback,2020-03-04,Wiley,English,1119602874,9781119602873,New York,United States,199.0,227.0,18.0,582.0,2020,3
"Machine Learning and Knowledge Extraction : Third IFIP TC 5, TC 12, WG 8.4, WG 8.9, WG 12.9 International Cross-Domain Conference, CD-MAKE 2019, Canterbury, UK, August 26-29, 2019, Proceedings","Andreas Holzinger, Peter Kieseberg, A Min Tjoa, Edgar Weippl",2094.0,https://d1w7fb2mkkr3kw.cloudfront.net/assets/images/book/lrg/9783/0302/9783030297251.jpg,,416.0,Paperback,2019-08-23,Springer,English,303029725X,9783030297251,Cham,Switzerland,155.0,235.0,22.35,658.0,2019,8
Machine Learning and Information Processing : Proceedings of ICMLIP 2019,"Debabala Swain, Prasant Kumar Pattnaik, Pradeep K. Gupta",5624.0,https://d1w7fb2mkkr3kw.cloudfront.net/assets/images/book/lrg/9789/8115/9789811518836.jpg,,537.0,Paperback,2020-03-24,Springer,English,9811518831,9789811518836,Singapore,Singapore,155.0,235.0,28.7,842.0,2020,3
AI and Machine Learning,Was Rahman,500.0,https://d1w7fb2mkkr3kw.cloudfront.net/assets/images/book/lrg/9789/3538/9789353884413.jpg,,180.0,Paperback,2020-11-14,Sage Publications India Pvt Ltd,English,9353884411,9789353884413,New Delhi,India,,,,,2020,11
Applied Machine Learning,David Forsyth,1865.0,https://d1w7fb2mkkr3kw.cloudfront.net/assets/images/book/lrg/9783/0301/9783030181161.jpg,3.5,494.0,Paperback,2020-08-14,Springer,English,3030181162,9783030181161,Cham,Switzerland,210.0,279.0,26.42,1259.0,2020,8
"Machine Learning for Cyber Security : Third International Conference, ML4CS 2020, Guangzhou, China, October 8-10, 2020, Proceedings, Part I","Xiaofeng Chen, Hongyang Yan, Qiben Yan, Xiangliang Zhang",3277.0,https://d1w7fb2mkkr3kw.cloudfront.net/assets/images/book/lrg/9783/0306/9783030622220.jpg,,650.0,Paperback,2020-12-24,Springer,English,3030622223,9783030622220,Cham,Switzerland,155.0,235.0,34.54,1027.0,2020,12
Quantum Machine Learning With Python : Using Cirq from Google Research and IBM Qiskit,Santanu Pattanayak,1006.0,https://d1w7fb2mkkr3kw.cloudfront.net/assets/images/book/lrg/9781/4842/9781484265215.jpg,,314.0,Paperback,2021-02-22,aPress,English,1484265211,9781484265215,Berkley,United States,,,,,2021,2
"Machine Learning in Social Networks : Embedding Nodes, Edges, Communities, and Graphs","Manasvi Aggarwal, M.N. Murty",1872.0,https://d1w7fb2mkkr3kw.cloudfront.net/assets/images/book/lrg/9789/8133/9789813340213.jpg,,112.0,Paperback,2021-02-06,Springer,English,9813340215,9789813340213,Singapore,Singapore,155.0,235.0,6.86,203.0,2021,2
The Book of Machine Learning Projects,"Nadia Udler, Phillip Bradford",1306.0,https://d1w7fb2mkkr3kw.cloudfront.net/assets/images/book/lrg/9780/1354/9780135473207.jpg,,,Paperback,2021-10-28,Pearson Education (US),,0135473209,9780135473207,Boston,United States,,,,,2021,10
Machine Learning for Beginners,Samuel Hack,670.0,https://d1w7fb2mkkr3kw.cloudfront.net/assets/images/book/lrg/9781/8011/9781801142939.jpg,,220.0,Paperback,2020-12-04,Samuel Hack,English,1801142939,9781801142939,,,152.0,229.0,12.0,299.0,2020,12
Machine Learning with Python,ML & Ai Academy,568.0,https://d1w7fb2mkkr3kw.cloudfront.net/assets/images/book/lrg/9781/8012/9781801255318.jpg,,186.0,Paperback,2020-11-21,Giale Ltd,English,1801255318,9781801255318,,,152.0,229.0,10.0,254.0,2020,11
"Machine Learning with Python : An Advanced Guide to Go Deep into Artificial Intelligence. Tools, Tips and Tricks for Going into Data Science and Data Analysis using Python and TensorFlow",Russel R Russo,577.0,https://d1w7fb2mkkr3kw.cloudfront.net/assets/images/book/lrg/9781/8011/9781801118590.jpg,,196.0,Paperback,2020-10-30,Zanshin Honya Ltd,English,1801118590,9781801118590,,,152.0,229.0,11.0,268.0,2020,10
Machine Learning Aplicado,Sammy Liberman,1282.0,https://d1w7fb2mkkr3kw.cloudfront.net/assets/images/book/lrg/9798/5545/9798554549359.jpg,,208.0,Paperback,2020-10-28,Independently Published,Spanish,,9798554549359,,,216.0,280.0,14.0,680.0,2020,10
"Machine Learning and Intelligent Communications : 5th International Conference, MLICOM 2020, Shenzhen, China, September 26-27, 2020, Proceedings","Mingxiang Guan, Zhenyu Na",2766.0,https://d1w7fb2mkkr3kw.cloudfront.net/assets/images/book/lrg/9783/0306/9783030667849.jpg,,528.0,Paperback,2021-02-14,Springer,English,3030667847,9783030667849,Cham,Switzerland,,,,,2021,2
"Machine Learning in Cyber Trust : Security, Privacy, and Reliability","Jeffrey J. P. Tsai, Philip S. Yu",4504.0,https://d1w7fb2mkkr3kw.cloudfront.net/assets/images/book/mid/9781/4419/9781441946980.jpg,2.4,362.0,Paperback,2010-11-05,Springer,English,1441946985,9781441946980,"New York, NY",United States,155.0,235.0,19.81,581.0,2010,11
"Machine Learning for Multimodal Interaction : Second International Workshop, MLMI 2005, Edinburgh, UK, July 11-13, 2005, Revised Selected Papers","Steve Renals, Samy Bengio",3665.0,https://d1w7fb2mkkr3kw.cloudfront.net/assets/images/book/lrg/9783/5403/9783540325499.jpg,,498.0,Paperback,2006-03-15,Springer,English,3540325492,9783540325499,Berlin,Germany,155.0,235.0,26.16,1560.0,2006,3
Machine Learning in Bioinformatics,"Wajahat Qazi, Khalil Ahmed",1569.0,https://d1w7fb2mkkr3kw.cloudfront.net/assets/images/book/lrg/9783/6392/9783639253726.jpg,,132.0,Paperback,2010-05-03,VDM Verlag,English,3639253728,9783639253726,,,152.0,229.0,8.0,204.0,2010,5
Innovations in Machine Learning : Theory and Applications,Dawn E. Holmes,3980.0,https://d1w7fb2mkkr3kw.cloudfront.net/assets/images/book/lrg/9783/6420/9783642067884.jpg,3.0,276.0,Paperback,2010-11-23,Springer,English,3642067883,9783642067884,Berlin,Germany,155.0,235.0,15.75,450.0,2010,11
"Building Machine Learning Systems with Python : Explore machine learning and deep learning techniques for building intelligent systems using scikit-learn and TensorFlow, 3rd Edition","Luis Pedro Coelho, Willi Richert, Matthieu Brucher",1310.0,https://d1w7fb2mkkr3kw.cloudfront.net/assets/images/book/lrg/9781/7886/9781788623223.jpg,3.8,406.0,Paperback,2018-07-31,Packt Publishing Limited,English,1788623223,9781788623223,Birmingham,United Kingdom,75.0,93.0,21.08,694.0,2018,7
Machine Learning in Medicine,"Ton J. Cleophas, Aeilko H. Zwinderman",2715.0,https://d1w7fb2mkkr3kw.cloudfront.net/assets/images/book/lrg/9789/4007/9789400793637.jpg,3.33,265.0,Paperback,2015-02-08,Springer,English,9400793634,9789400793637,Dordrecht,Netherlands,155.0,235.0,15.24,4336.0,2015,2
Soft Computing in Machine Learning,"Sang-Yong Rhee, Jooyoung Park, Atsushi Inoue",4223.0,https://d1w7fb2mkkr3kw.cloudfront.net/assets/images/book/lrg/9783/3190/9783319055329.jpg,4.0,117.0,Paperback,2014-03-19,Springer,English,3319055321,9783319055329,Cham,Switzerland,155.0,235.0,6.86,2058.0,2014,3
Machine Learning in Medicine : Part Two,"Ton J. Cleophas, Aeilko H. Zwinderman",2410.0,https://d1w7fb2mkkr3kw.cloudfront.net/assets/images/book/lrg/9789/4007/9789400795129.jpg,4.0,231.0,Paperback,2015-06-13,Springer,English,9400795122,9789400795129,Dordrecht,Netherlands,155.0,235.0,13.21,385.0,2015,6
Bootstrapping Machine Learning : The first guide to Prediction APIs,Louis Dorard,1495.0,https://d1w7fb2mkkr3kw.cloudfront.net/assets/images/book/lrg/9781/5007/9781500789244.jpg,,208.0,Paperback,2014-08-11,Createspace Independent Publishing Platform,English,1500789240,9781500789244,,,152.0,229.0,14.0,286.0,2014,8
Machine Learning with Python,Abhishek Vijayvargia,798.0,https://d1w7fb2mkkr3kw.cloudfront.net/assets/images/book/lrg/9789/3865/9789386551931.jpg,4.0,268.0,Paperback,2018-03-01,BPB Publications,English,9386551934,9789386551931,New Delhi,India,,,,,2018,3
Python Machine Learning : A Guide for Beginners (Second Edition),Leonard Eddison,494.0,https://d1w7fb2mkkr3kw.cloudfront.net/assets/images/book/lrg/9781/7210/9781721083459.jpg,2.9,202.0,Paperback,2018-06-12,Amazon Digital Services LLC - Kdp Print Us,English,1721083456,9781721083459,,,,,,,2018,6
Machine Learning for Evolution Strategies,Oliver Kramer,4204.0,https://d1w7fb2mkkr3kw.cloudfront.net/assets/images/book/lrg/9783/3198/9783319815008.jpg,,124.0,Paperback,2018-05-30,Springer,English,3319815008,9783319815008,Cham,Switzerland,155.0,235.0,7.37,2175.0,2018,5
Machine Learning Paradigms : Artificial Immune Systems and their Applications in Software Personalization,"Dionisios N. Sotiropoulos, George A. Tsihrintzis",4694.0,https://d1w7fb2mkkr3kw.cloudfront.net/assets/images/book/lrg/9783/3198/9783319836751.jpg,,327.0,Paperback,2018-06-16,Springer,English,3319836757,9783319836751,Cham,Switzerland,155.0,235.0,18.29,528.0,2018,6
Reverse Hypothesis Machine Learning : A Practitioner's Perspective,Parag Kulkarni,3714.0,https://d1w7fb2mkkr3kw.cloudfront.net/assets/images/book/lrg/9783/3198/9783319856261.jpg,,138.0,Paperback,2018-07-25,Springer,English,331985626X,9783319856261,Cham,Switzerland,155.0,235.0,8.38,2467.0,2018,7
