"Computer Programming and Cyber Security for Beginners : This Book Includes: Python Machine Learning, SQL, Linux, Hacking with Kali Linux, Ethical Hacking. Coding and Cybersecurity Fundamentals",Zach Codings,774.0,https://d1w7fb2mkkr3kw.cloudfront.net/assets/images/book/lrg/9781/8010/9781801091442.jpg,,410.0,Paperback,2020-10-09,Zach Codings,English,1801091447,9781801091442,,,152.0,229.0,21.0,544.0,2020,10
Data Science in Higher Education : A Step-by-Step Introduction to Machine Learning for Institutional Researchers,Jesse Lawson,587.0,https://d1w7fb2mkkr3kw.cloudfront.net/assets/images/book/lrg/9781/5152/9781515206460.jpg,3.12,226.0,Paperback,2015-09-06,Createspace Independent Publishing Platform,English,1515206467,9781515206460,,,152.0,229.0,12.0,308.0,2015,9
Extreme Learning Machines 2013: Algorithms and Applications,"Fuchen Sun, Kar-ann Toh, Manuel Grana Romay, Kezhi Mao",3626.0,https://d1w7fb2mkkr3kw.cloudfront.net/assets/images/book/lrg/9783/3193/9783319350035.jpg,,225.0,Paperback,2016-09-23,Springer,English,331935003X,9783319350035,Cham,Switzerland,155.0,235.0,12.45,3577.0,2016,9
Accelerating Software Quality : Machine Learning and Artificial Intelligence in the Age of DevOps,Eran Kinsbruner,748.0,https://d1w7fb2mkkr3kw.cloudfront.net/assets/images/book/lrg/9798/6711/9798671126044.jpg,5.0,358.0,Paperback,2020-08-10,Independently Published,English,,9798671126044,,,152.0,229.0,19.0,476.0,2020,8
Bayesian Reinforcement Learning : A Survey,"Mohammed Ghavamzadeh, Shie Mannor, Joelle Pineau, Aviv Tamar",1774.0,https://d1w7fb2mkkr3kw.cloudfront.net/assets/images/book/lrg/9781/6808/9781680830880.jpg,1.0,146.0,Paperback,2015-11-26,Now Publishers Inc,English,1680830880,9781680830880,Hanover,United States,156.0,234.0,8.0,216.0,2015,11
Spectral Learning on Matrices and Tensors,"Majid Janzamin, Rong Ge, Jean Kossaifi, Anima Anandkumar",2968.0,https://d1w7fb2mkkr3kw.cloudfront.net/assets/images/book/lrg/9781/6808/9781680836400.jpg,,156.0,Paperback,2019-11-28,Now Publishers Inc,English,1680836404,9781680836400,Hanover,United States,156.0,234.0,8.64,230.0,2019,11
Learning with Submodular Functions : A Convex Optimization Perspective,Francis Bach,2417.0,https://d1w7fb2mkkr3kw.cloudfront.net/assets/images/book/lrg/9781/6019/9781601987563.jpg,,258.0,Paperback,2013-12-04,Now Publishers Inc,English,1601987560,9781601987563,Hanover,United States,156.0,234.0,14.0,367.0,2013,12
An Introduction to Deep Reinforcement Learning,"Vincent François-Lavet, Peter Henderson, Riashat Islam, Marc G. Bellemare, Joelle Pineau",2587.0,https://d1w7fb2mkkr3kw.cloudfront.net/assets/images/book/lrg/9781/6808/9781680835380.jpg,4.4,156.0,Paperback,2019-03-31,Now Publishers Inc,English,1680835386,9781680835380,Hanover,United States,156.0,234.0,8.38,230.0,2019,3
Macroeconomic Forecasting Using Alternative Data : Techniques for Applying Big Data and Machine Learning,Apurv Jain,2514.0,https://d1w7fb2mkkr3kw.cloudfront.net/assets/images/book/lrg/9780/1281/9780128191217.jpg,,250.0,Paperback,2022-01-01,Elsevier Science Publishing Co Inc,English,012819121X,9780128191217,San Diego,United States,,,,,2022,1
"Applied Deep Learning with Python : Use scikit-learn, TensorFlow, and Keras to create intelligent systems and machine learning solutions","Alex Galea, Luis Capelo",1451.0,https://d1w7fb2mkkr3kw.cloudfront.net/assets/images/book/lrg/9781/7898/9781789804744.jpg,4.5,334.0,Paperback,2018-08-31,Packt Publishing Limited,English,1789804744,9781789804744,Birmingham,United Kingdom,75.0,93.0,17.02,553.38,2018,8
Applications of Deep Learning to Radar Polarimetry : A Physics First Approach to Machine Learning in Radar Earth Observation Applications,Shaunak de,2050.0,https://d1w7fb2mkkr3kw.cloudfront.net/assets/images/book/lrg/9786/1398/9786139815999.jpg,,212.0,Paperback,2018-07-12,LAP Lambert Academic Publishing,English,6139815991,9786139815999,,,150.0,220.0,13.0,332.0,2018,7
Applied Supervised Learning with Python : Use scikit-learn to build predictive models from real-world datasets and prepare yourself for the future of machine learning,"Benjamin Johnston, Ishita Mathur",1310.0,https://d1w7fb2mkkr3kw.cloudfront.net/assets/images/book/lrg/9781/7899/9781789954920.jpg,5.0,404.0,Paperback,2019-04-27,Packt Publishing Limited,English,1789954924,9781789954920,Birmingham,United Kingdom,75.0,93.0,21.08,689.46,2019,4
"Learning AWS IoT : Effectively manage connected devices on the AWS cloud using services such as AWS Greengrass, AWS button, predictive analytics and machine learning",Agus Kurniawan,1305.0,https://d1w7fb2mkkr3kw.cloudfront.net/assets/images/book/lrg/9781/7883/9781788396110.jpg,2.75,278.0,Paperback,2018-01-29,Packt Publishing Limited,English,1788396111,9781788396110,Birmingham,United Kingdom,75.0,93.0,14.73,480.81,2018,1
Hands-On Ensemble Learning with Python : Build highly optimized ensemble machine learning models using scikit-learn and Keras,"George Kyriakides, Konstantinos G. Margaritis",1310.0,https://d1w7fb2mkkr3kw.cloudfront.net/assets/images/book/lrg/9781/7896/9781789612851.jpg,,298.0,Paperback,2019-07-24,Packt Publishing Limited,English,1789612853,9781789612851,Birmingham,United Kingdom,75.0,93.0,15.75,517.1,2019,7
Learning to Classify Text Using Support Vector Machines,Thorsten Joachims,4714.0,https://d1w7fb2mkkr3kw.cloudfront.net/assets/images/book/lrg/9781/4613/9781461352983.jpg,4.1,205.0,Paperback,2012-11-01,Springer,English,1461352983,9781461352983,"New York, NY",United States,155.0,235.0,12.19,355.0,2012,11
Aprendizaje automatico con Python : Guia completa para principiantes sobre aprendizaje automatico en Python con ejercicios y estudios de casos(Libro En Espan̆ol/Machine Learning Spanish Book Version),Paige Jacobs,705.0,https://d1w7fb2mkkr3kw.cloudfront.net/assets/images/book/lrg/9781/0931/9781093136050.jpg,,198.0,Paperback,2019-04-07,Independently Published,Spanish,1093136057,9781093136050,,,152.0,229.0,11.0,272.0,2019,4
"Python : This Book Includes: The Guide for Beginners, Machine Learning",Josh Hugh Learning,636.0,https://d1w7fb2mkkr3kw.cloudfront.net/assets/images/book/lrg/9781/6732/9781673217094.jpg,,318.0,Paperback,2019-12-10,Independently Published,English,1673217095,9781673217094,,,152.0,229.0,17.0,426.0,2019,12
"Adaptation, Learning, and Optimization over Networks",Ali H. Sayed,1931.0,https://d1w7fb2mkkr3kw.cloudfront.net/assets/images/book/lrg/9781/6019/9781601988508.jpg,4.0,518.0,Paperback,2014-07-25,Now Publishers Inc,English,1601988508,9781601988508,Hanover,United States,156.0,234.0,26.0,719.0,2014,7
Principles of Machine Geology : Machine Learning Generated Literature,Hilary Goh,599.0,https://d1w7fb2mkkr3kw.cloudfront.net/assets/images/book/lrg/9781/7950/9781795015097.jpg,,26.0,Paperback,2019-01-25,Independently Published,English,1795015098,9781795015097,,,152.0,229.0,2.0,54.0,2019,1
Theory of Disagreement-Based Active Learning,Steve Hanneke,2317.0,https://d1w7fb2mkkr3kw.cloudfront.net/assets/images/book/lrg/9781/6019/9781601988089.jpg,5.0,198.0,Paperback,2014-06-12,Now Publishers Inc,English,1601988087,9781601988089,Hanover,United States,156.0,234.0,11.0,286.0,2014,6
Pathological Brain Detection by Advanced Extreme Learning Machines,Siyuan Lu,917.0,https://d1w7fb2mkkr3kw.cloudfront.net/assets/images/book/lrg/9783/6595/9783659585098.jpg,,68.0,Paperback,2017-10-04,LAP Lambert Academic Publishing,English,,9783659585098,,,,,,,2017,10
Reinforcement Learning und Support Vector Machines : Eine Übersicht,Florian Mulzer,1314.0,https://d1w7fb2mkkr3kw.cloudfront.net/assets/images/book/mid/9783/6390/9783639078558.jpg,,108.0,Paperback,2013-10-25,VDM Verlag Dr. Müller e.K.,German,3639078551,9783639078558,,,150.0,220.0,6.0,177.0,2013,10
"Data Science for Beginners : This Book Includes - Machine Learning for Beginners + Python Machine Learning for Beginners - Big Data Analytics, Data Science, Data Analysis and Programming Code",Leonard Deep,889.0,https://d1w7fb2mkkr3kw.cloudfront.net/assets/images/book/lrg/9781/0769/9781076939685.jpg,3.25,356.0,Paperback,2019-07-03,Independently Published,English,1076939686,9781076939685,,,152.0,229.0,20.0,522.0,2019,7
"Python Programming, Deep Learning : 3 Books in 1: A Complete Guide for Beginners, Python Coding for AI, Neural Networks, & Machine Learning, Data Science/Analysis with Practical Exercises for Learners",Anthony Adams,989.0,https://d1w7fb2mkkr3kw.cloudfront.net/assets/images/book/lrg/9781/9140/9781914065057.jpg,,558.0,Paperback,2020-12-12,Big Book Ltd,English,1914065050,9781914065057,,,152.0,229.0,29.0,735.0,2020,12
Mastering Computer Vision with TensorFlow 2.x : Build advanced computer vision applications using machine learning and deep learning techniques,Krishnendu Kar,1451.0,https://d1w7fb2mkkr3kw.cloudfront.net/assets/images/book/lrg/9781/8388/9781838827069.jpg,,430.0,Paperback,2020-05-15,Packt Publishing Limited,English,1838827064,9781838827069,Birmingham,United Kingdom,75.0,93.0,22.1,734.82,2020,5
"Machine Intelligence : Machine intelligence and applications, Artificial Intelligence (AI) and Machine Learning",Moaml Mohmmed,318.0,https://d1w7fb2mkkr3kw.cloudfront.net/assets/images/book/lrg/9781/6997/9781699755983.jpg,,74.0,Paperback,2019-10-14,Independently Published,English,1699755981,9781699755983,,,152.0,229.0,5.0,122.0,2019,10
Python for Data Science : Deep Machine Learning Algorithms in Python and Artificial Intelligence. Crash Course to Measure Value of Big Data and Analyzes what Matters to Live by Computer Programming,Mik Arduino,612.0,https://d1w7fb2mkkr3kw.cloudfront.net/assets/images/book/lrg/9781/7086/9781708623265.jpg,,156.0,Paperback,2019-11-15,Independently Published,English,1708623264,9781708623265,,,152.0,229.0,8.0,218.0,2019,11
Relational Knowledge Discovery,M. E. Muller,1454.0,https://d1w7fb2mkkr3kw.cloudfront.net/assets/images/book/lrg/9780/5211/9780521122047.jpg,4.0,280.0,Paperback,2012-07-30,CAMBRIDGE UNIVERSITY PRESS,English,052112204X,9780521122047,Cambridge,United Kingdom,173.0,247.0,15.0,520.0,2012,7
Statistical Literacy at School : Growth and Goals,Jane M. Watson,1874.0,https://d1w7fb2mkkr3kw.cloudfront.net/assets/images/book/lrg/9780/8058/9780805853995.jpg,,320.0,Paperback,2006-08-04,Taylor & Francis,English,0805853995,9780805853995,New York,United States,152.0,229.0,17.27,431.0,2006,8
Python: Advanced Guide to Artificial Intelligence : Expert machine learning systems and intelligent agents using Python,"Giuseppe Bonaccorso, Armando Fandango, Rajalingappaa shanmugamani",1591.0,https://d1w7fb2mkkr3kw.cloudfront.net/assets/images/book/lrg/9781/7899/9781789957211.jpg,3.0,764.0,Paperback,2018-12-21,Packt Publishing Limited,English,1789957214,9781789957211,Birmingham,United Kingdom,75.0,93.0,38.61,1288.2,2018,12
"Accelerated Learning & Speed Reading : 2 Manuscripts: Be a Learning Machine & Get More Done in Less Time! Boost Your Memory Ability, Develop Sharp Focus and Increase Reading Speed the Right Way!",Louis Watts,705.0,https://d1w7fb2mkkr3kw.cloudfront.net/assets/images/book/lrg/9781/7274/9781727402377.jpg,,188.0,Paperback,2018-09-16,Createspace Independent Publishing Platform,English,1727402375,9781727402377,,,127.0,203.0,10.0,191.0,2018,9
Learning Representation and Control in Markov Decision Processes : New Frontiers,Sridhar Mahadaven,2861.0,https://d1w7fb2mkkr3kw.cloudfront.net/assets/images/book/lrg/9781/6019/9781601982384.jpg,,184.0,Paperback,2009-06-30,Now Publishers Inc,English,1601982380,9781601982384,Hanover,United States,156.0,234.0,10.0,268.0,2009,6
Machine Trades,National Learning Corporation,1120.0,https://d1w7fb2mkkr3kw.cloudfront.net/assets/images/book/lrg/9781/7318/9781731870803.jpg,,128.0,Paperback,2020-03-15,Passbooks,English,1731870809,9781731870803,,,215.0,279.0,4.0,312.98,2020,3
Machine Trades,National Learning Corporation,1389.0,https://d1w7fb2mkkr3kw.cloudfront.net/assets/images/book/lrg/9781/7318/9781731857224.jpg,,166.0,Paperback,2020-03-15,Passbooks,English,1731857225,9781731857224,,,215.0,279.0,4.0,403.7,2020,3
Machine Drafting,National Learning Corporation,1414.0,https://d1w7fb2mkkr3kw.cloudfront.net/assets/images/book/lrg/9781/7318/9781731857248.jpg,,194.0,Paperback,2020-03-15,Passbooks,English,1731857241,9781731857248,,,215.0,279.0,4.0,462.66,2020,3
Statistical Clerk,National Learning Corporation,1181.0,https://d1w7fb2mkkr3kw.cloudfront.net/assets/images/book/lrg/9781/7318/9781731807625.jpg,,192.0,Paperback,2019-02-01,National Learning Corp,English,1731807627,9781731807625,,,216.0,280.0,10.0,458.0,2019,2
Hands-On Java Deep Learning for Computer Vision : Implement machine learning and neural network methodologies to perform computer vision-related tasks,Klevis Ramo,1029.0,https://d1w7fb2mkkr3kw.cloudfront.net/assets/images/book/lrg/9781/7896/9781789613964.jpg,,260.0,Paperback,2019-02-22,Packt Publishing Limited,English,1789613965,9781789613964,Birmingham,United Kingdom,75.0,93.0,13.97,453.59,2019,2
"Python for Data Analysis : The Ultimate Beginner's Guide to Learn The Basics Of Data Analysis, Pandas and Python Statistics. Discover Programming Language and Machine Learning.",Cooper Turner,618.0,https://d1w7fb2mkkr3kw.cloudfront.net/assets/images/book/lrg/9798/6377/9798637759514.jpg,1.0,166.0,Paperback,2020-04-16,Independently Published,English,,9798637759514,,,152.0,229.0,9.0,231.0,2020,4
"Artificial Intelligence : 2 Book In 1: The Beginner's Guide to Data Science, Data Analytics, Deep Learning, Machine Learning, Data Mining, Deep Medicine. The Revolution of the Future Today!",Benjamin Brown,708.0,https://d1w7fb2mkkr3kw.cloudfront.net/assets/images/book/lrg/9781/7043/9781704378664.jpg,,254.0,Paperback,2019-11-04,Independently Published,English,1704378664,9781704378664,,,152.0,229.0,13.0,345.0,2019,11
Duplicating Machine Operator,National Learning Corporation,1041.0,https://d1w7fb2mkkr3kw.cloudfront.net/assets/images/book/lrg/9781/7318/9781731814074.jpg,,166.0,Paperback,2020-10-15,National Learning Corp,English,1731814070,9781731814074,,,216.0,280.0,9.0,399.0,2020,10
Hoisting Machine Operator,National Learning Corporation,1154.0,https://d1w7fb2mkkr3kw.cloudfront.net/assets/images/book/lrg/9781/7318/9781731822574.jpg,,162.0,Paperback,2019-02-01,National Learning Corp,English,173182257X,9781731822574,,,215.0,279.0,4.0,394.63,2019,2
Machine Shop Workbook,National Learning Corporation,1304.0,https://d1w7fb2mkkr3kw.cloudfront.net/assets/images/book/lrg/9781/7318/9781731879035.jpg,,318.0,Paperback,2020-03-15,Passbooks,English,1731879032,9781731879035,,,215.0,279.0,4.0,743.89,2020,3
Senior Business Machine Operator,National Learning Corporation,1201.0,https://d1w7fb2mkkr3kw.cloudfront.net/assets/images/book/mid/9781/7318/9781731818966.jpg,,210.0,Paperback,2020-06-10,National Learning Corp,English,1731818963,9781731818966,,,216.0,280.0,11.0,503.0,2020,6
Office Machine Operator,National Learning Corporation,1120.0,https://d1w7fb2mkkr3kw.cloudfront.net/assets/images/book/mid/9781/7318/9781731805591.jpg,,126.0,Paperback,2020-06-10,National Learning Corp,English,1731805594,9781731805591,,,216.0,280.0,7.0,313.0,2020,6
Photo Machine Operator,National Learning Corporation,895.0,https://d1w7fb2mkkr3kw.cloudfront.net/assets/images/book/lrg/9781/7318/9781731813909.jpg,,182.0,Paperback,2019-02-01,National Learning Corp,English,1731813902,9781731813909,,,216.0,280.0,10.0,435.0,2019,2
Offset Printing Machine Operator,National Learning Corporation,1193.0,https://d1w7fb2mkkr3kw.cloudfront.net/assets/images/book/lrg/9781/7318/9781731805621.jpg,,204.0,Paperback,2020-10-15,National Learning Corp,English,1731805624,9781731805621,,,216.0,280.0,11.0,485.0,2020,10
"Python for Beginners : A Step by Step Guide to Python Programming, Data Science, and Predictive Model. A Practical Introduction to Machine Learning with Python",Josh Hugh Learning,618.0,https://d1w7fb2mkkr3kw.cloudfront.net/assets/images/book/lrg/9781/6922/9781692298418.jpg,,166.0,Paperback,2019-09-10,Independently Published,English,1692298410,9781692298418,,,152.0,229.0,9.0,231.0,2019,9
Refrigerating Machine Mechanic,National Learning Corporation,1427.0,https://d1w7fb2mkkr3kw.cloudfront.net/assets/images/book/mid/9781/7318/9781731814517.jpg,,206.0,Paperback,2019-02-01,National Learning Corp,English,1731814518,9781731814517,,,216.0,280.0,11.0,494.0,2019,2
Medical Transcribing Machine Operator,National Learning Corporation,1052.0,https://d1w7fb2mkkr3kw.cloudfront.net/assets/images/book/mid/9781/7318/9781731832030.jpg,,178.0,Paperback,2020-06-10,National Learning Corp,English,1731832036,9781731832030,,,216.0,280.0,10.0,426.0,2020,6
Transcribing Machine Operator,National Learning Corporation,1122.0,https://d1w7fb2mkkr3kw.cloudfront.net/assets/images/book/lrg/9781/7318/9781731810670.jpg,,130.0,Paperback,2019-02-01,National Learning Corp,English,1731810679,9781731810670,,,215.0,279.0,4.0,317.51,2019,2
Business Machine Maintainer & Repairer,National Learning Corporation,1108.0,https://d1w7fb2mkkr3kw.cloudfront.net/assets/images/book/mid/9781/7318/9781731811554.jpg,,114.0,Paperback,2019-02-01,National Learning Corp,English,1731811551,9781731811554,,,215.0,279.0,4.0,285.76,2019,2
Learn PySpark : Build Python-based Machine Learning and Deep Learning Models,Pramod Singh,838.0,https://d1w7fb2mkkr3kw.cloudfront.net/assets/images/book/lrg/9781/4842/9781484249604.jpg,3.0,210.0,Paperback,2019-09-24,aPress,English,1484249607,9781484249604,Berkley,United States,155.0,235.0,12.19,355.0,2019,9
Refrigerating Machine Operator,National Learning Corporation,968.0,https://d1w7fb2mkkr3kw.cloudfront.net/assets/images/book/lrg/9781/7318/9781731806703.jpg,,222.0,Paperback,2019-02-01,National Learning Corp,English,1731806701,9781731806703,,,216.0,280.0,12.0,526.0,2019,2
Photocopy Machine Operator,National Learning Corporation,918.0,https://d1w7fb2mkkr3kw.cloudfront.net/assets/images/book/lrg/9781/7318/9781731829719.jpg,,158.0,Paperback,2019-02-01,National Learning Corp,English,173182971X,9781731829719,,,216.0,280.0,9.0,381.0,2019,2
Senior Duplicating Machine Operator,National Learning Corporation,1102.0,https://d1w7fb2mkkr3kw.cloudfront.net/assets/images/book/mid/9781/7318/9781731818997.jpg,,108.0,Paperback,2020-06-10,National Learning Corp,English,1731818998,9781731818997,,,216.0,280.0,6.0,272.0,2020,6
A Tutorial on Linear Function Approximators for Dynamic Programming and Reinforcement Learning,"Alborz Geramifard, Thomas J. Walsh, Tellex Stefanie, Girish Chowdhary, Nicholas Roy, Jonathan P. How",1682.0,https://d1w7fb2mkkr3kw.cloudfront.net/assets/images/book/lrg/9781/6019/9781601987600.jpg,,92.0,Paperback,2013-12-19,Now Publishers Inc,English,1601987609,9781601987600,Hanover,United States,156.0,234.0,5.0,143.0,2013,12
"Graphical Models, Exponential Families, and Variational Inference","Martin J. Wainwright, Michael I. Jordan",3292.0,https://d1w7fb2mkkr3kw.cloudfront.net/assets/images/book/lrg/9781/6019/9781601981844.jpg,4.43,324.0,Paperback,2008-12-16,Now Publishers Inc,English,1601981848,9781601981844,Hanover,United States,156.0,234.0,17.0,457.0,2008,12
From Bandits to Monte-Carlo Tree Search : The Optimistic Principle Applied to Optimization and Planning,Rèmi Munos,2258.0,https://d1w7fb2mkkr3kw.cloudfront.net/assets/images/book/lrg/9781/6019/9781601987662.jpg,5.0,146.0,Paperback,2014-01-31,Now Publishers Inc,English,1601987668,9781601987662,Hanover,United States,156.0,234.0,8.0,216.0,2014,1
"Studyguide for Neural Networks and Learning Machines by Haykin, Simon, ISBN 9780131471399",Cram101 Textbook Reviews,1099.0,https://d1w7fb2mkkr3kw.cloudfront.net/assets/images/book/lrg/9781/6174/9781617445811.jpg,,220.0,Paperback,2011-03-31,CRAM101,English,1617445819,9781617445811,"Sim Valley, CA",United States,,,,,2011,3
Introduction to Multi-Armed Bandits,Aleksandrs Slivkins,2652.0,https://d1w7fb2mkkr3kw.cloudfront.net/assets/images/book/lrg/9781/6808/9781680836202.jpg,,306.0,Paperback,2019-11-07,Now Publishers Inc,English,168083620X,9781680836202,Hanover,United States,156.0,234.0,16.26,435.0,2019,11
A Tutorial on Thompson Sampling,"Daniel J. Russo, Benjamin Van Roy, Abbas Kazerouni, Ian Osband, Zheng Wen",2086.0,https://d1w7fb2mkkr3kw.cloudfront.net/assets/images/book/lrg/9781/6808/9781680834703.jpg,,112.0,Paperback,2018-07-12,Now Publishers Inc,English,1680834703,9781680834703,Hanover,United States,156.0,234.0,6.1,170.0,2018,7
An Introduction to Wishart Matrix Moments,"Adrian N. Bishop, Pierre del Moral, Angele Niclas",1694.0,https://d1w7fb2mkkr3kw.cloudfront.net/assets/images/book/lrg/9781/6808/9781680835069.jpg,,134.0,Paperback,2019-02-28,Now Publishers Inc,English,1680835068,9781680835069,Hanover,United States,156.0,234.0,7.37,200.0,2019,2
An Introduction to Conditional Random Fields,"Charles Sutton, Andrew McCallum",2213.0,https://d1w7fb2mkkr3kw.cloudfront.net/assets/images/book/lrg/9781/6019/9781601985729.jpg,4.67,120.0,Paperback,2012-08-23,Now Publishers Inc,English,160198572X,9781601985729,Hanover,United States,156.0,234.0,6.0,181.0,2012,8
"Office Machine Aide, Volume 1579",National Learning Corporation,933.0,https://d1w7fb2mkkr3kw.cloudfront.net/assets/images/book/lrg/9781/7318/9781731815798.jpg,,174.0,Paperback,2020-02-01,Passbooks,English,1731815794,9781731815798,,,216.0,280.0,9.0,417.0,2020,2
"Basin Machine Operator, Volume 2517",National Learning Corporation,1021.0,https://d1w7fb2mkkr3kw.cloudfront.net/assets/images/book/lrg/9781/7318/9781731825179.jpg,,128.0,Paperback,2020-02-15,Passbooks,English,173182517X,9781731825179,,,216.0,280.0,7.0,318.0,2020,2
"Cost and Statistical Analyst, Volume 3561",National Learning Corporation,1253.0,https://d1w7fb2mkkr3kw.cloudfront.net/assets/images/book/lrg/9781/7318/9781731835611.jpg,,156.0,Paperback,2020-02-15,Passbooks,English,1731835612,9781731835611,,,216.0,280.0,9.0,381.0,2020,2
Metric Learning,"Aurelien Bellet, Amaury Habrard, Marc Sebban",1853.0,https://d1w7fb2mkkr3kw.cloudfront.net/assets/images/book/lrg/9781/6270/9781627053655.jpg,,151.0,Paperback,2015-01-30,Morgan & Claypool Publishers,English,1627053654,9781627053655,"San Rafael, CA",United States,187.0,235.0,8.38,272.16,2015,1
"Outcomes of Learning : Results from the 2000 Program for International Student Assessment of 15-Year-Olds in Reading, Mathematics, and Science Literacy. Statistical Analysis Report. [revised] - Scholar's Choice Edition",United States Department of Education Ed,612.0,https://d1w7fb2mkkr3kw.cloudfront.net/assets/images/book/lrg/9781/2980/9781298013309.jpg,,154.0,Paperback,2015-02-14,Scholar's Choice,English,1298013305,9781298013309,,,189.0,246.0,8.0,286.0,2015,2
"Python For Beginners : Ride The Wave Of Artificial Intelligence And Machine Learning With This Crash Course On Python Programming, Deepening Data Analysis & Science With Real Computer Programming Codes",Learning Python In Deep,690.0,https://d1w7fb2mkkr3kw.cloudfront.net/assets/images/book/lrg/9781/7094/9781709466731.jpg,,128.0,Paperback,2019-11-19,Independently Published,English,1709466731,9781709466731,,,152.0,229.0,7.0,181.0,2019,11
"Outcomes of Learning : Results from the 2000 Program for International Student Assessment of 15-Year-Olds in Reading, Mathematics, and Science Literacy. Statistical Analysis Report. [Revised]",United States Department of Education Ed,612.0,https://d1w7fb2mkkr3kw.cloudfront.net/assets/images/book/lrg/9781/2406/9781240629077.jpg,,154.0,Paperback,2011-01-01,Bibliogov,English,1240629079,9781240629077,Charleston SC,United States,189.0,246.0,8.0,286.0,2011,1
"Outcomes of Learning : Results from the 2000 Program for International Student Assessment of 15-Year-Olds in Reading, Mathematics, and Science Literacy. Statistical Analysis Report. [revised] - Scholar's Choice Edition",United States Department of Education Ed,612.0,https://d1w7fb2mkkr3kw.cloudfront.net/assets/images/book/lrg/9781/2980/9781298013309.jpg,,154.0,Paperback,2015-02-14,Scholar's Choice,English,1298013305,9781298013309,,,189.0,246.0,8.0,286.0,2015,2
Python Programming for Beginners : Learn Python Machine Learning Language from Scratch and Deep Learning,Chris Sebastian,539.0,https://d1w7fb2mkkr3kw.cloudfront.net/assets/images/book/lrg/9781/7950/9781795050531.jpg,3.5,162.0,Paperback,2019-01-24,Independently Published,English,1795050535,9781795050531,,,127.0,203.0,9.0,181.0,2019,1
S1 to National 4 Physics : Practise and Learn Cfe Topics,"Anna Lee, James Spence, Leckie",372.0,https://d1w7fb2mkkr3kw.cloudfront.net/assets/images/book/lrg/9780/0082/9780008263652.jpg,,96.0,Paperback,2018-06-14,HarperCollins Publishers,English,0008263655,9780008263652,London,United Kingdom,192.0,265.0,5.0,240.0,2018,6
"Distribution Clerk, Machine (U.S.P.S.), Volume 2255",National Learning Corporation,1006.0,https://d1w7fb2mkkr3kw.cloudfront.net/assets/images/book/lrg/9781/7318/9781731822550.jpg,,128.0,Paperback,2020-04-20,Passbooks,English,1731822553,9781731822550,,,216.0,280.0,7.0,318.0,2020,4
"Data Entry Machine Operator, Volume 2409",National Learning Corporation,956.0,https://d1w7fb2mkkr3kw.cloudfront.net/assets/images/book/lrg/9781/7318/9781731824097.jpg,,170.0,Paperback,2020-02-15,Passbooks,English,1731824092,9781731824097,,,216.0,280.0,9.0,408.0,2020,2
"Data Science Live Book : An Intuitive and Practical Approach to Data Analysis, Data Preparation and Machine Learning, Suitable for All Ages! (Black & White Version)",Pablo Casas,693.0,https://d1w7fb2mkkr3kw.cloudfront.net/assets/images/book/lrg/9789/8742/9789874269041.jpg,5.0,306.0,Paperback,2018-03-27,Pablo Adrian Casas,English,9874269049,9789874269041,,,152.0,229.0,18.0,449.0,2018,3
"Javascript Artificial Intelligence : Made Easy, w/ Essential Programming; Create your * Problem Solving * Algorithms! TODAY! w/ Machine Learning & Data Structures",Code Well Academy,533.0,https://d1w7fb2mkkr3kw.cloudfront.net/assets/images/book/lrg/9781/5308/9781530826872.jpg,2.0,156.0,Paperback,2016-04-15,Createspace Independent Publishing Platform,English,153082687X,9781530826872,,,152.0,229.0,8.0,218.0,2016,4
